id,facilityInternal,agencyInternal,agencyFullNameInternal,stateInternal,company,canonicalFacilityId,createdAt,hidden_override,notes,googlePlaceName,address,longitude,latitude,county,googlePlaceId,state
709,NY DOC - BARE HILL CORRECTIONAL FACILITY,,,NY,SECURUS,,2021-01-09T00:36:12.276Z,false,,Edgecombe Correctional Facility,"611 Edgecombe Ave, New York, NY 10032, United States",-73.9381405,40.8362963,New York County,ChIJMbaI6YL2wokR5ceZJkZTuUY,NY
710,NY DOC - BEDFORD HILLS CORRECITONAL FACILITY,,,NY,SECURUS,,2021-01-09T00:36:21.423Z,false,,NYSDOC Taconic Correctional Facility,"250 Harris Rd, Bedford Hills, NY 10507, United States",-73.6790141,41.24361150000001,Westchester County,ChIJcyZZHBWwwokRe9rfd2KbCpQ,NY
711,NY DOC - CAPE VINCENT CORRECTIONAL FACILITY,,,NY,SECURUS,,2021-01-09T00:36:32.642Z,false,,Cape Vincent Correctional Facility,"36560 NY-12E, Cape Vincent, NY 13618, United States",-76.1883616,44.19764379999999,Jefferson County,ChIJlzJFRvxMzUwRKSG3Sck4koI,NY
712,NY DOC - CAYUGA CORRECTIONAL FACILITY,,,NY,SECURUS,,2021-01-09T00:36:42.880Z,false,,NYSDOC Cayuga Correctional Facility,"2202 NY-38A, Moravia, NY 13118, United States",-76.3961932,42.7218024,Cayuga County,ChIJR7Mc2WMK2okRCdu5AlhQjyI,NY
713,NY DOC - CLINTON CORRECTIONAL ANNEX,,,NY,SECURUS,,2021-01-09T00:36:51.571Z,false,,Clinton Correctional Facility,"1156 Cook St, Dannemora, NY 12929, United States",-73.72117779999999,44.7231146,Clinton County,ChIJeyKh6rxKykwRgYpttLJKFHg,NY
714,NY DOC - CLINTON CORRECTIONAL FACILITY,,,NY,SECURUS,,2021-01-09T00:37:01.980Z,false,,New York City Corrections Department,"New York, NY 10004, United States",-74.0159658,40.7057919,New York County,ChIJNRq8gRFawokRwDA_cGXuFVA,NY
715,NY DOC - COLLINS CORRECTIONAL FACILITY,,,NY,SECURUS,,2021-01-09T00:37:11.018Z,false,,NYSDOC Collins Correctional Facility,"Middle Rd, Collins, NY 14034, United States",-78.9402558,42.4916038,Erie County,ChIJU79vqgfm0okRqi8VJqO9A6k,NY
716,NY DOC - COXSACKIE CORRECTIONAL FACILITY,,,NY,SECURUS,,2021-01-09T00:37:20.380Z,false,,Coxsackie Correctional Facility,"11260 Rte 9W, Coxsackie, NY 12051, United States",-73.8366866,42.343665,Greene County,ChIJE0vLh6bq3YkRW50-tirC7Kc,NY
717,NY DOC - DOWNSTATE CORRECTIONAL FACILITY,,,NY,SECURUS,,2021-01-09T00:37:28.633Z,false,,Manhattan Detention Complex,"125 White St, New York, NY 10013, United States",-74.0002524,40.716972,New York County,ChIJBWTIzyBawokRMVa1kkL9v0g,NY
718,NY DOC - EASTERN NEW YORK CORRECTIONAL FACILITY,,,NY,SECURUS,,2021-01-09T00:37:36.795Z,false,,New York City Department of Corrections,"11-11 Hazen St, East Elmhurst, NY 11370, United States",-73.8965114,40.7706535,Queens County,ChIJTV-hunBfwokRInzF59Rs8P8,NY
719,NY DOC - EDGECOMBE RESIDENTIAL TREATMENT FACILITY,,,NY,SECURUS,,2021-01-09T00:37:46.902Z,false,,Edgecombe Residential Treatment Program,"611 Edgecombe Ave, New York, NY 10032, United States",-73.93759659999999,40.8362516,New York County,ChIJMbaI6YL2wokR4njB0zGu5iA,NY
720,NY DOC - ELMIRA CORRECTIONAL FACILITY AND RECEPTION CENTER,,,NY,SECURUS,,2021-01-09T00:37:54.965Z,false,,New York City Department of Corrections,"11-11 Hazen St, East Elmhurst, NY 11370, United States",-73.8965114,40.7706535,Queens County,ChIJTV-hunBfwokRInzF59Rs8P8,NY
721,NY DOC - FISHKILL CORRECTIONAL FACILITY,,,NY,SECURUS,,2021-01-09T00:38:03.904Z,false,,Fishkill Correctional Facility,"18 Strack Dr, Beacon, NY 12508, United States",-73.95087029999999,41.5219847,Dutchess County,ChIJUbBePDox3YkRDt8ByDAQgdM,NY
722,NY DOC - FIVE POINTS CORRECTIONAL FACILITY,,,NY,SECURUS,,2021-01-09T00:38:11.688Z,false,,Bayview Correctional Facility,"550 W 20th St, New York, NY 10011, United States",-74.0076928,40.7465398,New York County,ChIJ_5yrhMdZwokRgR8xgUZGHlM,NY
723,NY DOC - FRANKLIN CORRECTIONAL FACILITY,,,NY,SECURUS,,2021-01-09T00:38:19.602Z,false,,New York City Corrections Department,"New York, NY 10004, United States",-74.0159658,40.7057919,New York County,ChIJNRq8gRFawokRwDA_cGXuFVA,NY
724,NY DOC - GOUVERNEUR CORRECTIONAL FACILITY,,,NY,SECURUS,,2021-01-09T00:38:27.042Z,false,,Gouverneur Correctional Facility,"112 Scotch Settlement Rd, Gouverneur, NY 13642, United States",-75.442134,44.340119,St. Lawrence County,ChIJ0d5_QafdzEwRuLw9OshybFo,NY
725,NY DOC - GOWANDA CORRECTIONAL FACILITY,,,NY,SECURUS,,2021-01-09T00:38:34.527Z,false,,Gowanda Correctional Facility,"S Rd, Gowanda, NY 14070, United States",-78.93597199999999,42.4869841,Erie County,ChIJ-_sy0wLm0okR5a-fWVkIkvk,NY
726,NY DOC - GREAT MEADOW CORRECTIONAL FACILITY,,,NY,SECURUS,,2021-01-09T00:38:44.887Z,false,,Bayview Correctional Facility,"550 W 20th St, New York, NY 10011, United States",-74.0076928,40.7465398,New York County,ChIJ_5yrhMdZwokRgR8xgUZGHlM,NY
727,NY DOC - GREEN HAVEN CORRECTIONAL FACILITY,,,NY,SECURUS,,2021-01-09T00:38:52.682Z,false,,Green Haven Correctional Facility,"594 NY-216, Stormville, NY 12582, United States",-73.71820509999999,41.5823225,Dutchess County,ChIJV2SRw9hF3YkRuzEGaQHghO4,NY
728,NY DOC - GREENE CORRECTIONAL FACILITY,,,NY,SECURUS,,2021-01-09T00:39:00.309Z,false,,New York City Corrections Department,"New York, NY 10004, United States",-74.0159658,40.7057919,New York County,ChIJNRq8gRFawokRwDA_cGXuFVA,NY
729,NY DOC - GROVELAND CORRECTIONAL FACILITY,,,NY,SECURUS,,2021-01-09T00:39:08.161Z,false,,Bayview Correctional Facility,"550 W 20th St, New York, NY 10011, United States",-74.0076928,40.7465398,New York County,ChIJ_5yrhMdZwokRgR8xgUZGHlM,NY
730,NY DOC - HALE CREEK CORRECTIONAL FACILITY,,,NY,SECURUS,,2021-01-09T00:39:17.274Z,false,,NYSDOC Hale Creek Correctional Facility,"279 Maloney Rd, Johnstown, NY 12095, United States",-74.2986583,43.0135915,Fulton County,ChIJc3pgD6_03okRLTsQgnsQ3Q8,NY
731,NY DOC - HUDSON CORRECTIONAL FACILITY,,,NY,SECURUS,,2021-01-09T00:39:29.826Z,false,,New York City Correction Department,"60 Hudson St # 600, New York, NY 10013, United States",-74.0086369,40.7177788,New York County,ChIJIU1Qth9awokRLyKpre1caS4,NY
732,NY DOC - LAKEVIEW SHOCK INCARCERATION CORRECTIONAL FACILITY,,,NY,SECURUS,,2021-01-09T00:39:42.916Z,false,,Lakeview Shock Incarceration Center,"9300 Lake Ave, Brocton, NY 14716, United States",-79.4369043,42.4066184,Chautauqua County,ChIJRx0QdJE1LYgRc4I5obCMCfI,NY
733,NY DOC - MARCY CORRECTIONAL FACILITY,,,NY,SECURUS,,2021-01-09T00:39:55.604Z,false,,Marcy Correctional Facility,"9000 Old River Rd, Marcy, NY 13403, United States",-75.3079037,43.160718,Oneida County,ChIJI4bP774_2YkRd8dZNAQ-eCY,NY
734,NY DOC - MID STATE CORRECTIONAL FACILITY,,,NY,SECURUS,,2021-01-09T00:40:06.285Z,false,,Edgecombe Correctional Facility,"611 Edgecombe Ave, New York, NY 10032, United States",-73.9381405,40.8362963,New York County,ChIJMbaI6YL2wokR5ceZJkZTuUY,NY
735,NY DOC - MOHAWK CORRECTIONAL FACILITY,,,NY,SECURUS,,2021-01-09T00:40:18.107Z,false,,New York City Corrections Department,"New York, NY 10004, United States",-74.0159658,40.7057919,New York County,ChIJNRq8gRFawokRwDA_cGXuFVA,NY
736,NY DOC - MORIAH SHOCK INCARCERATION CORRECTIONAL FACILITY,,,NY,SECURUS,,2021-01-09T00:40:27.533Z,false,,Bayview Correctional Facility,"550 W 20th St, New York, NY 10011, United States",-74.0076928,40.7465398,New York County,ChIJ_5yrhMdZwokRgR8xgUZGHlM,NY
737,NY DOC - OGDENSBURG CORRECTIONAL FACILITY,,,NY,SECURUS,,2021-01-09T00:40:35.496Z,false,,NYSDOC Ogdensburg Correctional Facility,"1 Correction Way, Ogdensburg, NY 13669, United States",-75.4443539,44.723378,St. Lawrence County,ChIJJSoAsqGrzUwRs_qG0wWPt34,NY
738,NY DOC - ORLEANS CORRECTIONAL FACILITY,,,NY,SECURUS,,2021-01-09T00:40:43.737Z,false,,NYSDOC Orleans Correctional Facility,"3531 Gaines Basin Rd, Albion, NY 14411, United States",-78.222479,43.24416,Orleans County,ChIJLQ002eoL1IkRaGgN1WQ473A,NY
739,NY DOC - OTISVILLE CORRECTIONAL FACILITY,,,NY,SECURUS,,2021-01-09T00:40:51.676Z,false,,New York State - Otisville Correctional Facility,"57 Sanitorium Ave, Otisville, NY 10963, United States",-74.528728,41.4794788,Orange County,ChIJKUsPAuo0w4kRBbyFOIJ6Cmg,NY
740,NY DOC - QUEENSBORO CORRECTIONAL FACILITY,,,NY,SECURUS,,2021-01-09T00:41:00.177Z,false,,Queensboro Correctional Facility,"47-04 Van Dam St, Long Island City, NY 11101, United States",-73.9341677,40.7426566,Queens County,ChIJGZMNZtNewokRnDdQ2b_VMqA,NY
741,NY DOC - RIVERVIEW CORRECTIONAL FACILITY,,,NY,SECURUS,,2021-01-09T00:41:09.378Z,false,,Manhattan Detention Complex,"125 White St, New York, NY 10013, United States",-74.0002524,40.716972,New York County,ChIJBWTIzyBawokRMVa1kkL9v0g,NY
742,NY DOC - ROCHESTER CORRECTIONAL FACILITY,,,NY,SECURUS,,2021-01-09T00:41:17.332Z,false,,New York City Corrections Department,"New York, NY 10004, United States",-74.0159658,40.7057919,New York County,ChIJNRq8gRFawokRwDA_cGXuFVA,NY
743,NY DOC - SHAWANGUNK CORRECTIONAL FACILITY,,,NY,SECURUS,,2021-01-09T00:41:25.137Z,false,,Shawangunk Correctional Facility,"200 Quick Rd, Wallkill, NY 12589, United States",-74.1635513,41.6356411,Ulster County,ChIJdzxdEymU3YkRPfYl_dhwsfE,NY
744,NY DOC - SING SING CORRECTIONAL FACILITY,,,NY,SECURUS,,2021-01-09T00:41:35.084Z,false,,Sing Sing Correctional Facility,"354 Hunter St, Ossining, NY 10562, United States",-73.8679897,41.1511759,Westchester County,ChIJ3bLSS8DAwokRajbxwIL7-W0,NY
745,NY DOC - SONYEA YOUTH FACILITY,,,NY,SECURUS,,2021-01-09T00:41:42.378Z,false,,Groveland Correctional Facility,"7000 Sonyea Rd, Sonyea, NY 14556, United States",-77.8337165,42.6832991,Livingston County,ChIJ_cmj4bJk0YkReB6CTAHqQ7w,NY
746,NY DOC - SOUTHPORT CORRECTIONAL FACILITY,,,NY,SECURUS,,2021-01-09T00:41:50.096Z,false,,New York City Corrections Department,"New York, NY 10004, United States",-74.0159658,40.7057919,New York County,ChIJNRq8gRFawokRwDA_cGXuFVA,NY
747,NY DOC - SULLIVAN CORRECTIONAL FACILITY,,,NY,SECURUS,,2021-01-09T00:41:58.235Z,false,,NYSDOC Sullivan Correctional Facility,"325 Riverside Dr, Fallsburg, NY 12733, United States",-74.58948199999999,41.741558,Sullivan County,ChIJ1xJozVTH3IkRMVfgjkmhHNc,NY
748,NY DOC - TACONIC CORRECTIONAL FACILITY,,,NY,SECURUS,,2021-01-09T00:42:09.818Z,false,,NYSDOC Taconic Correctional Facility,"250 Harris Rd, Bedford Hills, NY 10507, United States",-73.6790141,41.24361150000001,Westchester County,ChIJcyZZHBWwwokRe9rfd2KbCpQ,NY
749,NY DOC - ULSTER CORRECTIONAL FACILITY,,,NY,SECURUS,,2021-01-09T00:42:19.983Z,false,,NYSDOC Ulster Correctional Facility,"750 Berme Rd, Napanoch, NY 12458, United States",-74.3564256,41.7435804,Ulster County,ChIJByMc1azd3IkRTdA_RF9NtwM,NY
750,NY DOC - UPSTATE CORRECTIONAL FACILITY,,,NY,SECURUS,,2021-01-09T00:42:31.348Z,false,,Edgecombe Correctional Facility,"611 Edgecombe Ave, New York, NY 10032, United States",-73.9381405,40.8362963,New York County,ChIJMbaI6YL2wokR5ceZJkZTuUY,NY
751,NY DOC - WALLKILL CORRECTIONAL FACILITY,,,NY,SECURUS,,2021-01-09T00:42:44.199Z,false,,NYSDOC Wallkill Correctional Facility,"50 McKendrick Rd, Wallkill, NY 12589, United States",-74.163444,41.6281345,Ulster County,ChIJRZJTDkQm3YkRwrPexaTmvbg,NY
752,NY DOC - WASHINGTON CORRECTIONAL FACILITY,,,NY,SECURUS,,2021-01-09T00:42:53.529Z,false,,Edgecombe Correctional Facility,"611 Edgecombe Ave, New York, NY 10032, United States",-73.9381405,40.8362963,New York County,ChIJMbaI6YL2wokR5ceZJkZTuUY,NY
753,NY DOC - WATERTOWN CORRECTIONAL FACILITY,,,NY,SECURUS,,2021-01-09T00:43:05.077Z,false,,New York City Corrections Department,"New York, NY 10004, United States",-74.0159658,40.7057919,New York County,ChIJNRq8gRFawokRwDA_cGXuFVA,NY
754,NY DOC - WENDE CORRECTIONAL FACILITY,,,NY,SECURUS,,2021-01-09T00:43:14.545Z,false,,Metropolitan Correctional Center,"150 Park Row, New York, NY 10007, United States",-74.001505,40.71312940000001,New York County,ChIJNcdH_iNawokRwblTY2JAuR0,NY
755,NY DOC - WILLARD DRUG TREATMENT CAMPUS,,,NY,SECURUS,,2021-01-09T00:43:22.796Z,false,,,,,,,,NY
756,NY DOC - WOODBOURNE CORRECTIONAL FACILITY,,,NY,SECURUS,,2021-01-09T00:43:31.977Z,false,,NYSDOC Woodbourne Correctional Facility,"99 Prison Rd, Woodbourne, NY 12788, United States",-74.5932576,41.75407209999999,Sullivan County,ChIJp0wmili_3IkRwt_mRjIXeY8,NY
757,NY DOC - WYOMING CORRECTIONAL FACILITY,,,NY,SECURUS,,2021-01-09T00:43:40.508Z,false,,Wyoming Correctional Facility,"3203 Dunbar Rd, Attica, NY 14011, United States",-78.2650254,42.8487815,Wyoming County,ChIJ6VNeYF7A04kR2Gni6arIxjo,NY
758,ONTARIO COUNTY JAIL,,,NY,SECURUS,,2021-01-09T00:43:51.294Z,false,,Ontario County Jail,"3045 County Complex Dr, Canandaigua, NY 14424, United States",-77.2125788,42.8807898,Ontario County,ChIJOW7Kd54n0YkRug04jbLPvAk,NY
759,ROCKLAND COUNTY JAIL,,,NY,SECURUS,,2021-01-09T00:44:01.010Z,false,,Rockland County Corrections Division,"53 New Hempstead Rd, New City, NY 10956, United States",-73.99371119999999,41.1465397,Rockland County,ChIJwy_Uqf3CwokRV4UjkNSKNNo,NY
760,SUFFOLK COUNTY JAIL,,,NY,SECURUS,,2021-01-09T00:44:10.239Z,false,,Suffolk County Sheriff's Office Riverhead Correctional Facility,"100 Center Dr S, Riverhead, NY 11901, United States",-72.6710288,40.9147018,Suffolk County,ChIJiS_o5Cz16IkRrqE4nw5DEsY,NY
761,SUFFOLK COUNTY JAIL / YAPHANK,,,NY,SECURUS,,2021-01-09T00:44:20.054Z,false,,Suffolk County Sheriff's Office Yaphank Correctional Facility,"200 Suffolk Ave, Yaphank, NY 11980, United States",-72.9240145,40.8158862,Suffolk County,ChIJA7LfIEBF6IkR-hccxHkwHOs,NY
762,SUFFOLK COUNTY JAIL BOOKING,,,NY,SECURUS,,2021-01-09T00:44:31.184Z,false,,Suffolk County Sheriff's Office Riverhead Correctional Facility,"100 Center Dr S, Riverhead, NY 11901, United States",-72.6710288,40.9147018,Suffolk County,ChIJiS_o5Cz16IkRrqE4nw5DEsY,NY
763,SULLIVAN COUNTY JAIL,,,NY,SECURUS,,2021-01-09T00:44:41.529Z,false,,Sullivan County Jail,"4 Bushnell Ave, Monticello, NY 12701, United States",-74.68441109999999,41.6557944,Sullivan County,ChIJ4SUxczW33IkREYPL3slzdKI,NY
764,ULSTER COUNTY JAIL,,,NY,SECURUS,,2021-01-09T00:44:52.211Z,false,,Ulster County Jail,"380 Boulevard, Kingston, NY 12401, United States",-74.015976,41.912252,Ulster County,ChIJY2hLEpIP3YkRyAL174PIiEs,NY
765,WESTCHESTER COUNTY DOC,,,NY,SECURUS,,2021-01-09T00:45:02.948Z,false,,Westchester County Correction,"10 Woods Rd, Valhalla, NY 10595, United States",-73.8037262,41.0783381,Westchester County,ChIJb4NdH9e_wokRPmhi9DZgYU4,NY
766,ALBEMARLE DISTRICT JAIL,,,NC,SECURUS,,2021-01-09T00:45:14.727Z,false,,Albemarle District Jail,"210 Executive Dr, Elizabeth City, NC 27909, United States",-76.3069318,36.3572129,Pasquotank County,ChIJY0-1ORFFpYkRpdIcJf9UrkI,NC
767,ANSON COUNTY SHERIFF'S OFFICE,,,NC,SECURUS,,2021-01-09T00:45:30.009Z,false,,Anson County Jail,"119 N Washington St, Wadesboro, NC 28170, United States",-80.0758498,34.9670271,Anson County,ChIJ8WSNHj74VIgRnNOfyz8MCAI,NC
768,AVERY COUNTY SHERIFF'S OFFICE,,,NC,SECURUS,,2021-01-09T00:45:43.090Z,false,,Avery County Communication,"300 Schultz Cir, Newland, NC 28657, United States",-81.9267849,36.0862929,Avery County,ChIJ10sgz42TUIgRDldHU8Eo0MA,NC
769,BLADEN COUNTY LAW ENFORCEMENT CENTER,,,NC,SECURUS,,2021-01-09T00:45:54.638Z,false,,Bladen County Detention Center,"299 Smith Cir, Elizabethtown, NC 28337, United States",-78.6075956,34.6151531,Bladen County,ChIJRdqvaFFUqokRHXMdBuDEFBM,NC
770,BRUNSWICK COUNTY JAIL,,,NC,SECURUS,,2021-01-09T00:46:04.307Z,false,,Brunswick County Jail,"70 Stamp Act Dr NE, Bolivia, NC 28422, United States",-78.1637899,34.0590326,Brunswick County,ChIJtb-9HvsOqokRG01-SiqBz34,NC
771,CLEVELAND COUNTY DETENTION FACILITY,,,NC,SECURUS,,2021-01-09T00:46:15.879Z,false,,Cleveland County Detention Center,"100 Justice Pl #104a, Shelby, NC 28150, United States",-81.5362672,35.2907442,Cleveland County,ChIJZ15eLhUgV4gRqyRWRxyaQbo,NC
772,CLEVELAND COUNTY JAIL ANNEX,,,NC,SECURUS,,2021-01-09T00:46:24.394Z,false,,Jail Annex,"407 McBrayer St, Shelby, NC 28150, United States",-81.544252,35.2869565,Cleveland County,ChIJx9fnXjkgV4gRdxGiSA9JCCg,NC
773,CRAVEN COUNTY JAIL,,,NC,SECURUS,,2021-01-09T00:46:40.821Z,false,,Craven County Jail,"1100 Clarks Rd, New Bern, NC 28563, United States",-77.1829461,35.1328693,Craven County,ChIJNc5AwpXRqIkRMJa7WmKuRKw,NC
774,DARE COUNTY DETENTION CENTER,,,NC,SECURUS,,2021-01-09T00:46:54.861Z,false,,Dare County Detention Center,"1044 Driftwood Dr, Manteo, NC 27954, United States",-75.6900575,35.9182783,Dare County,ChIJk3dFsEr9pIkR5BGTKGYZCg8,NC
775,FRANKLIN COUNTY DETENTION CENTER,,,NC,SECURUS,,2021-01-09T00:47:06.198Z,false,,Franklin County Jail,"285 T Kemp Rd, Louisburg, NC 27549, United States",-78.31948729999999,36.0944392,Franklin County,ChIJTcBiWby1rYkRM_jXhrUF7Nw,NC
776,HOKE COUNTY DETENTION CENTER,,,NC,SECURUS,,2021-01-09T00:47:15.926Z,false,,Hoke County Sheriff's Office,"429 E Central Ave, Raeford, NC 28376, United States",-79.217086,34.979139,Hoke County,ChIJG094nr4wq4kRNwBmHCOstlo,NC
777,IREDELL COUNTY ANNEX,,,NC,SECURUS,,2021-01-09T00:47:25.342Z,false,,Iredell County Detention Center,"221 E Water St, Statesville, NC 28677, United States",-80.8856527,35.788065,Iredell County,ChIJkVZX4HdZUYgRtB45YDACeGk,NC
778,IREDELL COUNTY DETENTION CENTER,,,NC,SECURUS,,2021-01-09T00:47:36.919Z,false,,Iredell County Detention Center,"221 E Water St, Statesville, NC 28677, United States",-80.8856527,35.788065,Iredell County,ChIJkVZX4HdZUYgRtB45YDACeGk,NC
779,JOHNSTON COUNTY JAIL,,,NC,SECURUS,,2021-01-09T00:47:51.431Z,false,,Johnston County Jail,"127 S 2nd St, Smithfield, NC 27577, United States",-78.34750919999999,35.5108222,Johnston County,ChIJbWsSJGVyrIkRLei0K4PBvWQ,NC
780,MADISON COUNTY DETENTION CENTER,,,NC,SECURUS,,2021-01-09T00:48:01.707Z,false,,Madison County Sheriff Department,"348 Medical Park Dr, Marshall, NC 28753, United States",-82.6531935,35.8045535,Madison County,ChIJhceVxDYkWogR1LaQmHsHeUU,NC
781,MONTGOMERY COUNTY SHERIFF'S OFFICE,,,NC,SECURUS,,2021-01-09T00:48:11.008Z,false,,Montgomery County Sheriff's Office,"111 W Main St, Troy, NC 27371, United States",-79.8944357,35.3583309,Montgomery County,ChIJdctYUeCaVIgR-n7uxZN1vFY,NC
782,NEW HANOVER COUNTY DETENTION CENTER,,,NC,SECURUS,,2021-01-09T00:48:19.879Z,false,,New Hanover Correctional Center,"330 Division Dr, Wilmington, NC 28401, United States",-77.9237136,34.2661972,New Hanover County,ChIJ_anX8auKqYkR1_c7xRDjAaA,NC
783,ONSLOW COUNTY JAIL,,,NC,SECURUS,,2021-01-09T00:48:30.329Z,false,,Onslow County Jail,"717 Court St, Jacksonville, NC 28540, United States",-77.4312013,34.75170689999999,Onslow County,ChIJqVOn884RqYkRyTxcRlP2Tzs,NC
784,PAMLICO COUNTY DETENTION FACILITY,,,NC,SECURUS,,2021-01-09T00:48:44.105Z,false,,Pamlico Correctional Institution,"601 3rd St, Bayboro, NC 28515, United States",-76.7711075,35.1601467,Pamlico County,ChIJKThB9vi0qIkRdoxIqEogNhM,NC
785,PENDER COUNTY JAIL,,,NC,SECURUS,,2021-01-09T00:48:56.632Z,false,,Pender County Sheriff’s Office,"605 E Fremont St, Burgaw, NC 28425, United States",-77.9186204,34.5512942,Pender County,ChIJIdIaiZ6AqYkRlI0HCeUW5Ds,NC
786,RICHMOND COUNTY JAIL,,,NC,SECURUS,,2021-01-09T00:49:08.243Z,false,,Richmond County Sheriff Department,"1 Court St, Rockingham, NC 28379, United States",-79.77312189999999,34.9372347,Richmond County,ChIJzxHdC8jnVIgR0nKk6L67bbc,NC
787,ROWAN COUNTY DETENTION CENTER,,,NC,SECURUS,,2021-01-09T00:49:21.422Z,false,,Rowan County Detention Center,"115 W Liberty St, Salisbury, NC 28144, United States",-80.4683895,35.6694574,Rowan County,ChIJpZ5KWNjyU4gRdJbC14YAaQQ,NC
788,ROWAN COUNTY DETENTION CENTER ANNEX,,,NC,SECURUS,,2021-01-09T00:49:34.591Z,false,,Rowan County Detention Center,"115 W Liberty St, Salisbury, NC 28144, United States",-80.4683895,35.6694574,Rowan County,ChIJpZ5KWNjyU4gRdJbC14YAaQQ,NC
789,RUTHERFORD COUNTY DETENTION CENTER,,,NC,SECURUS,,2021-01-09T00:49:47.012Z,false,,Rutherford County Jail,"198 N Washington St, Rutherfordton, NC 28139, United States",-81.9580731,35.3698483,Rutherford County,ChIJAcJq3eNDV4gRPG9RE5y0pBo,NC
790,CASS COUNTY SHERIFF'S OFFICE,,,ND,SECURUS,,2021-01-09T00:50:01.213Z,false,,Cass County Law Enforcement Center,"1612 23rd Ave N, Fargo, ND 58102, United States",-96.8039033,46.90799579999999,Cass County,ChIJo0XLDyfKyFIRNyyDDEGK8DY,ND
791,DAKOTA WOMEN'S CORRECTIONAL AND REHABILITATION CENTER,,,ND,SECURUS,,2021-01-09T00:50:13.334Z,false,,Dakota Women's Correctional,"440 McKenzie St, New England, ND 58647, United States",-102.8670681,46.5355844,Hettinger County,ChIJdVOZUUOwKFMR6VzKpY6sEN0,ND
792,HEART OF AMERICA CORRECTIONAL & TREATMENT CENTER,,,ND,SECURUS,,2021-01-09T00:50:22.305Z,false,,Heart of America Correctional and Treatment Center,"110 Industrial Rd, Rugby, ND 58368, United States",-99.9775761,48.3736398,Pierce County,ChIJh_0hq_5z3FIRGpsM8E-6QBg,ND
793,ND DOC - JAMES RIVER CORRECTIONAL CENTER,,,ND,SECURUS,,2021-01-09T00:50:30.834Z,false,,James River Correctional Center,"Circle Dr, Jamestown, ND 58401, United States",-98.6840761,46.88177109999999,Stutsman County,ChIJJxBpEgAU0FIRXxILjS0-Mkc,ND
794,ND DOC - JAMES RIVER MINIMUM UNIT,,,ND,SECURUS,,2021-01-09T00:50:39.807Z,false,,James River Correctional Center,"Circle Dr, Jamestown, ND 58401, United States",-98.6840761,46.88177109999999,Stutsman County,ChIJJxBpEgAU0FIRXxILjS0-Mkc,ND
795,ND DOC - MISSOURI RIVER CORRECTIONAL CENTER,,,ND,SECURUS,,2021-01-09T00:50:52.317Z,false,,Missouri River Correctional,"1800 48th Ave SW, Bismarck, ND 58506, United States",-100.8220672,46.7538108,Burleigh County,ChIJd2Jz3xKb11IRE9JO9iEyj58,ND
796,ND DOC - NORTH DAKOTA STATE HOSPITAL,,,ND,SECURUS,,2021-01-09T00:51:37.081Z,false,,North Dakota State Hospital,"2605 Circle Dr, Jamestown, ND 58401, United States",-98.6852969,46.8840008,Stutsman County,ChIJ60t1SAAU0FIRkp-5jYKdLHA,ND
797,ND DOC - NORTH DAKOTA STATE PENITENTIARY,,,ND,SECURUS,,2021-01-09T00:51:55.863Z,false,,North Dakota State Penitentiary,"3100 Railroad Ave, Bismarck, ND 58501, United States",-100.7522211,46.80401579999999,Burleigh County,ChIJ1Zr1Ld2C11IRfqtBkZ8vm1I,ND
798,ALLEN COUNTY SHERIFF'S OFFICE,,,OH,SECURUS,,2021-01-09T00:52:08.156Z,false,,Allen County Sheriff's Office & Jail,"333 N Main St, Lima, OH 45801, United States",-84.1053092,40.743832,Allen County,ChIJp6BB6QvyPogRGWdkidfnKOc,OH
799,ASHTABULA CITY POLICE DEPT,,,OH,SECURUS,,2021-01-09T00:52:19.107Z,false,,Ashtabula Police Department,"110 W 44th St #1/2, Ashtabula, OH 44004, United States",-80.78013899999999,41.867102,Ashtabula County,ChIJGYH-tokfMogRyOVZwS_4oTk,OH
800,ASHTABULA COUNTY JAIL,,,OH,SECURUS,,2021-01-09T00:52:33.225Z,false,,Ashtabula County Sheriff,"25 W Jefferson St, Jefferson, OH 44047, United States",-80.79589440000001,41.7381477,Ashtabula County,ChIJ__8_za0nMogRNNKyN4J7Azk,OH
801,BEDFORD HEIGHTS CITY POLICE DEPT,,,OH,SECURUS,,2021-01-09T00:52:48.408Z,false,,Bedford Heights Police Department,"5661 Perkins Rd, Bedford Heights, OH 44146, United States",-81.49801599999999,41.4052883,Cuyahoga County,ChIJYz_GoD0dMYgR0GPStVUDzyM,OH
802,BEDFORD POLICE DEPT,,,OH,SECURUS,,2021-01-09T00:53:02.498Z,false,,Bedford Police Department,"165 Center Rd, Bedford, OH 44146, United States",-81.53875599999999,41.39717400000001,Cuyahoga County,ChIJ_VowiELiMIgREb2LHS4AkxY,OH
803,BROADVIEW HEIGHTS POLICE DEPT,,,OH,SECURUS,,2021-01-09T00:53:11.778Z,false,,Broadview Heights Police Department,"9543 Broadview Rd, Broadview Heights, OH 44147, United States",-81.67926489999999,41.3050709,Cuyahoga County,ChIJzYRpDfrnMIgRvAbO6Vg1v98,OH
804,CARROLL COUNTY SHERIFF'S OFFICE,,,OH,SECURUS,,2021-01-09T00:53:21.482Z,false,,Carroll County Sheriff,"43 2nd St SE, Carrollton, OH 44615, United States",-81.0858768,40.57189049999999,Carroll County,ChIJ3TFGeS2UNogRsUawLbM3vjM,OH
805,CLARK COUNTY JAIL,,,OH,SECURUS,,2021-01-09T00:53:29.898Z,false,,Clark County Sheriff's Office,"120 N Fountain Ave, Springfield, OH 45502, United States",-83.809842,39.9264435,Clark County,ChIJXb58LbJbP4gRIt59yRhRgXQ,OH
806,CLARK COUNTY JUVENILE DETENTION CENTER,,,OH,SECURUS,,2021-01-09T00:53:39.713Z,false,,Clark County Juvenile Detention,"101 E Columbia St, Springfield, OH 45502, United States",-83.8078712,39.9255252,Clark County,ChIJawWPurNbP4gRNqRrqhPd648,OH
807,CLINTON COUNTY ADULT DETENTION,,,OH,SECURUS,,2021-01-09T00:53:50.100Z,false,,Clinton County Sheriff's Office,"1645 Davids Dr, Wilmington, OH 45177, United States",-83.81589020000001,39.4193479,Clinton County,ChIJmXh_Fo7GQIgREGlKk9qqw7E,OH
808,COLUMBIANA COUNTY JAIL,,,OH,SECURUS,,2021-01-09T00:54:00.108Z,false,,Columbiana County Jail,"8473 County Home Rd, Lisbon, OH 44432, United States",-80.8321878,40.7809135,Columbiana County,ChIJwX1kpOECNIgRPZFvDRKqkHQ,OH
809,COLUMBIANA MINIMUM SECURITY NAC,,,OH,SECURUS,,2021-01-09T00:54:10.805Z,false,,Columbiana County Jail,"8473 County Home Rd, Lisbon, OH 44432, United States",-80.8321878,40.7809135,Columbiana County,ChIJwX1kpOECNIgRPZFvDRKqkHQ,OH
810,CUYAHOGA COUNTY JUSTICE CENTER,,,OH,SECURUS,,2021-01-09T00:54:30.444Z,false,,Cuyahoga County Jail,"1215 W 3rd St, Cleveland, OH 44113, United States",-81.697287,41.501608,Cuyahoga County,ChIJUSGsSIfwMIgR4ygdakjnbXA,OH
811,CUYAHOGA COUNTY JUVENILE DETENTION,,,OH,SECURUS,,2021-01-09T00:54:44.794Z,false,,Cuyahoga County Detention Center,"9300 Quincy Ave, Cleveland, OH 44106, United States",-81.6204489,41.4927781,Cuyahoga County,ChIJtVaEuXX7MIgRNwGQWEQfJf8,OH
812,DARKE COUNTY JAIL,,,OH,SECURUS,,2021-01-09T00:54:56.943Z,false,,Darke County Jail,"5185 County Home Rd, Greenville, OH 45331, United States",-84.6276855,40.0681292,Darke County,ChIJca47xODsP4gRO_GO_dLe29w,OH
813,EASTERN OHIO CORRECTIONAL CENTER,,,OH,SECURUS,,2021-01-09T00:55:15.435Z,false,,Eastern Ohio Correction Center,"470 OH-43, Wintersville, OH 43953, United States",-80.7322279,40.4001192,Jefferson County,ChIJFa16u9cuNIgRO7luK4jQ9gI,OH
814,EASTERN OHIO CORRECTIONAL CENTER ANNEX,,,OH,SECURUS,,2021-01-09T00:55:30.003Z,false,,Eastern Ohio Correction Center,"227 N Market St, Lisbon, OH 44432, United States",-80.7683984,40.7742699,Columbiana County,ChIJWT0ApeECNIgR87gVyCtxcpo,OH
815,ERIE COUNTY JAIL,,,OH,SECURUS,,2021-01-09T00:55:39.309Z,false,,Erie County Jail,"2800 Columbus Ave, Sandusky, OH 44870, United States",-82.6920258,41.4287907,Erie County,ChIJG1VFT15GOogRW8rzFx7ClNo,OH
